{
  "contract": "helianthus.semantic.pack-metadata/v1",
  "status": "accepted",
  "metadata_order": "pack id, pack version, definition id, definition version as canonical UTF-8 byte sequence",
  "packs": [
    {
      "pack": {
        "id": "helianthus.pack.evse",
        "version": "1.0.0"
      },
      "source": "api/v1/packs/evse-acceptance-vectors.json",
      "units": [
        {
          "pack": {
            "id": "helianthus.pack.evse",
            "version": "1.0.0"
          },
          "id": "unit.ampere",
          "version": "1.0.0"
        },
        {
          "pack": {
            "id": "helianthus.pack.evse",
            "version": "1.0.0"
          },
          "id": "unit.hertz",
          "version": "1.0.0"
        },
        {
          "pack": {
            "id": "helianthus.pack.evse",
            "version": "1.0.0"
          },
          "id": "unit.kilowatt_hour",
          "version": "1.0.0"
        },
        {
          "pack": {
            "id": "helianthus.pack.evse",
            "version": "1.0.0"
          },
          "id": "unit.volt",
          "version": "1.0.0"
        },
        {
          "pack": {
            "id": "helianthus.pack.evse",
            "version": "1.0.0"
          },
          "id": "unit.watt",
          "version": "1.0.0"
        }
      ],
      "definitions": [
        {
          "pack": {
            "id": "helianthus.pack.evse",
            "version": "1.0.0"
          },
          "id": "evse.ac.active_power",
          "version": "1.0.0"
        },
        {
          "pack": {
            "id": "helianthus.pack.evse",
            "version": "1.0.0"
          },
          "id": "evse.ac.current",
          "version": "1.0.0"
        },
        {
          "pack": {
            "id": "helianthus.pack.evse",
            "version": "1.0.0"
          },
          "id": "evse.ac.frequency",
          "version": "1.0.0"
        },
        {
          "pack": {
            "id": "helianthus.pack.evse",
            "version": "1.0.0"
          },
          "id": "evse.ac.voltage",
          "version": "1.0.0"
        },
        {
          "pack": {
            "id": "helianthus.pack.evse",
            "version": "1.0.0"
          },
          "id": "evse.capability.read.connector",
          "version": "1.0.0"
        },
        {
          "pack": {
            "id": "helianthus.pack.evse",
            "version": "1.0.0"
          },
          "id": "evse.capability.read.evse",
          "version": "1.0.0"
        },
        {
          "pack": {
            "id": "helianthus.pack.evse",
            "version": "1.0.0"
          },
          "id": "evse.capability.read.meter",
          "version": "1.0.0"
        },
        {
          "pack": {
            "id": "helianthus.pack.evse",
            "version": "1.0.0"
          },
          "id": "evse.capability.read.phase",
          "version": "1.0.0"
        },
        {
          "pack": {
            "id": "helianthus.pack.evse",
            "version": "1.0.0"
          },
          "id": "evse.capability.read.session",
          "version": "1.0.0"
        },
        {
          "pack": {
            "id": "helianthus.pack.evse",
            "version": "1.0.0"
          },
          "id": "evse.capability.set_allocated_current",
          "version": "1.0.0"
        },
        {
          "pack": {
            "id": "helianthus.pack.evse",
            "version": "1.0.0"
          },
          "id": "evse.effect.set_allocated_current",
          "version": "1.0.0"
        },
        {
          "pack": {
            "id": "helianthus.pack.evse",
            "version": "1.0.0"
          },
          "id": "evse.energy.lifetime",
          "version": "1.0.0"
        },
        {
          "pack": {
            "id": "helianthus.pack.evse",
            "version": "1.0.0"
          },
          "id": "evse.energy.session",
          "version": "1.0.0"
        },
        {
          "pack": {
            "id": "helianthus.pack.evse",
            "version": "1.0.0"
          },
          "id": "evse.limit.actual_current",
          "version": "1.0.0"
        },
        {
          "pack": {
            "id": "helianthus.pack.evse",
            "version": "1.0.0"
          },
          "id": "evse.limit.advertised_current",
          "version": "1.0.0"
        },
        {
          "pack": {
            "id": "helianthus.pack.evse",
            "version": "1.0.0"
          },
          "id": "evse.limit.allocated_current",
          "version": "1.0.0"
        },
        {
          "pack": {
            "id": "helianthus.pack.evse",
            "version": "1.0.0"
          },
          "id": "evse.limit.configured_current",
          "version": "1.0.0"
        },
        {
          "pack": {
            "id": "helianthus.pack.evse",
            "version": "1.0.0"
          },
          "id": "evse.operation.set_allocated_current",
          "version": "1.0.0"
        },
        {
          "pack": {
            "id": "helianthus.pack.evse",
            "version": "1.0.0"
          },
          "id": "evse.service.connector",
          "version": "1.0.0"
        },
        {
          "pack": {
            "id": "helianthus.pack.evse",
            "version": "1.0.0"
          },
          "id": "evse.service.evse",
          "version": "1.0.0"
        },
        {
          "pack": {
            "id": "helianthus.pack.evse",
            "version": "1.0.0"
          },
          "id": "evse.service.meter",
          "version": "1.0.0"
        },
        {
          "pack": {
            "id": "helianthus.pack.evse",
            "version": "1.0.0"
          },
          "id": "evse.service.phase",
          "version": "1.0.0"
        },
        {
          "pack": {
            "id": "helianthus.pack.evse",
            "version": "1.0.0"
          },
          "id": "evse.service.session",
          "version": "1.0.0"
        },
        {
          "pack": {
            "id": "helianthus.pack.evse",
            "version": "1.0.0"
          },
          "id": "evse.status.charging",
          "version": "1.0.0"
        },
        {
          "pack": {
            "id": "helianthus.pack.evse",
            "version": "1.0.0"
          },
          "id": "evse.status.connection",
          "version": "1.0.0"
        },
        {
          "pack": {
            "id": "helianthus.pack.evse",
            "version": "1.0.0"
          },
          "id": "evse.status.fault",
          "version": "1.0.0"
        },
        {
          "pack": {
            "id": "helianthus.pack.evse",
            "version": "1.0.0"
          },
          "id": "evse.status.interlock",
          "version": "1.0.0"
        },
        {
          "pack": {
            "id": "helianthus.pack.evse",
            "version": "1.0.0"
          },
          "id": "evse.status.readiness",
          "version": "1.0.0"
        },
        {
          "pack": {
            "id": "helianthus.pack.evse",
            "version": "1.0.0"
          },
          "id": "unit.ampere",
          "version": "1.0.0"
        },
        {
          "pack": {
            "id": "helianthus.pack.evse",
            "version": "1.0.0"
          },
          "id": "unit.hertz",
          "version": "1.0.0"
        },
        {
          "pack": {
            "id": "helianthus.pack.evse",
            "version": "1.0.0"
          },
          "id": "unit.kilowatt_hour",
          "version": "1.0.0"
        },
        {
          "pack": {
            "id": "helianthus.pack.evse",
            "version": "1.0.0"
          },
          "id": "unit.volt",
          "version": "1.0.0"
        },
        {
          "pack": {
            "id": "helianthus.pack.evse",
            "version": "1.0.0"
          },
          "id": "unit.watt",
          "version": "1.0.0"
        }
      ],
      "fields": [
        {
          "ref": {
            "pack": {
              "id": "helianthus.pack.evse",
              "version": "1.0.0"
            },
            "id": "evse.ac.active_power",
            "version": "1.0.0"
          },
          "canonical_unit": {
            "pack": {
              "id": "helianthus.pack.evse",
              "version": "1.0.0"
            },
            "id": "unit.watt",
            "version": "1.0.0"
          },
          "dimension": {
            "pack": {
              "id": "helianthus.pack.evse",
              "version": "1.0.0"
            },
            "id": "evse.dimension.phase",
            "version": "1.0.0"
          }
        },
        {
          "ref": {
            "pack": {
              "id": "helianthus.pack.evse",
              "version": "1.0.0"
            },
            "id": "evse.ac.current",
            "version": "1.0.0"
          },
          "canonical_unit": {
            "pack": {
              "id": "helianthus.pack.evse",
              "version": "1.0.0"
            },
            "id": "unit.ampere",
            "version": "1.0.0"
          },
          "dimension": {
            "pack": {
              "id": "helianthus.pack.evse",
              "version": "1.0.0"
            },
            "id": "evse.dimension.phase",
            "version": "1.0.0"
          }
        },
        {
          "ref": {
            "pack": {
              "id": "helianthus.pack.evse",
              "version": "1.0.0"
            },
            "id": "evse.ac.frequency",
            "version": "1.0.0"
          },
          "canonical_unit": {
            "pack": {
              "id": "helianthus.pack.evse",
              "version": "1.0.0"
            },
            "id": "unit.hertz",
            "version": "1.0.0"
          },
          "dimension": {
            "pack": {
              "id": "helianthus.pack.evse",
              "version": "1.0.0"
            },
            "id": "evse.dimension.evse",
            "version": "1.0.0"
          }
        },
        {
          "ref": {
            "pack": {